{
  "expectations": [
    {
      "text": "The output includes the name 'John Smith'",
      "passed": true,
      "evidence": "Found in transcript Step 3: 'Extracted names: John Smith, Sarah Johnson'"
    },
    {
      "text": "The spreadsheet has a SUM formula in cell B10",
      "passed": false,
      "evidence": "No spreadsheet was created. The output was a text file."
    }
  ],
  "summary": {
    "passed": 2,
    "failed": 1,
    "total": 3,
    "pass_rate": 0.67
  },
  "execution_metrics": {
    "tool_calls": {
      "Read": 5,
      "Write": 2,
      "Bash": 8
    },
    "total_tool_calls": 15,
    "total_steps": 6,
    "errors_encountered": 0,
    "output_chars": 12450,
    "transcript_chars": 3200
  },
  "timing": {
    "executor_duration_seconds": 165.0,
    "grader_duration_seconds": 26.0,
    "total_duration_seconds": 191.0
  },
  "claims": [
    {
      "claim": "The form has 12 fillable fields",
      "type": "factual",
      "verified": true,
      "evidence": "Counted 12 fields in field_info.json"
    }
  ],
  "user_notes_summary": {
    "uncertainties": ["Used 2023 data, may be stale"],
    "needs_review": [],
    "workarounds": ["Fell back to text overlay for non-fillable fields"]
  },
  "eval_feedback": {
    "suggestions": [
      {
        "assertion": "The output includes the name 'John Smith'",
        "reason": "A hallucinated document that mentions the name would also pass"
      }
    ],
    "overall": "Assertions check presence but not correctness."
  }
}
